{
  "schema": "ADworkflo.impact_report.v1",
  "task_id": "unconfigured",
  "status": "not_run",
  "baseline_revision": null,
  "current_revision": null,
  "declared_files": [],
  "predicted_files": [],
  "changed_files": [],
  "observed_impact_files": [],
  "unexpected_impact": [],
  "symbol_delta": {"added": [], "removed": []},
  "edge_delta": {
    "calls": {"added": [], "removed": []},
    "references": {"added": [], "removed": []},
    "imports": {"added": [], "removed": []}
  },
  "new_critical_unresolved_edges": [],
  "review_required": false
}
